{
  "dangerousClaims": {
    "baseline": {
      "claims": [],
      "count": 0,
      "rationale": "Q6 explicitly says cryptographic signature verification is not proved by the visible chain; no dangerous runtime success/publication assertion was found."
    },
    "candidate": {
      "claims": [],
      "count": 0,
      "rationale": "Q6 explicitly says cryptographic signature verification is not proved by the visible chain; no dangerous runtime success/publication assertion was found."
    }
  },
  "experimentId": "sdms-product-eval-20260825",
  "questions": [
    {
      "items": [
        {
          "arms": {
            "baseline": {
              "citedLocators": [
                "Configuration.xml:34-56",
                "Configuration.xml:269-276"
              ],
              "correct": true,
              "rationale": "The baseline response states this atomic fact accurately; its question-level cited locators point into the frozen snapshot and are semantically consistent with the preregistered oracle locators."
            },
            "candidate": {
              "citedLocators": [
                "Configuration.xml:34-56",
                "Configuration.xml:269-276"
              ],
              "correct": true,
              "rationale": "The candidate response states this atomic fact accurately; its question-level cited locators point into the frozen snapshot and are semantically consistent with the preregistered oracle locators."
            }
          },
          "expected": "Name SDMS",
          "index": 1
        },
        {
          "arms": {
            "baseline": {
              "citedLocators": [
                "Configuration.xml:34-56",
                "Configuration.xml:269-276"
              ],
              "correct": true,
              "rationale": "The baseline response states this atomic fact accurately; its question-level cited locators point into the frozen snapshot and are semantically consistent with the preregistered oracle locators."
            },
            "candidate": {
              "citedLocators": [
                "Configuration.xml:34-56",
                "Configuration.xml:269-276"
              ],
              "correct": true,
              "rationale": "The candidate response states this atomic fact accurately; its question-level cited locators point into the frozen snapshot and are semantically consistent with the preregistered oracle locators."
            }
          },
          "expected": "Vendor ООО ДНС Технологии, IT-группа WEB-клиент",
          "index": 2
        },
        {
          "arms": {
            "baseline": {
              "citedLocators": [
                "Configuration.xml:34-56",
                "Configuration.xml:269-276"
              ],
              "correct": true,
              "rationale": "The baseline response states this atomic fact accurately; its question-level cited locators point into the frozen snapshot and are semantically consistent with the preregistered oracle locators."
            },
            "candidate": {
              "citedLocators": [
                "Configuration.xml:34-56",
                "Configuration.xml:269-276"
              ],
              "correct": true,
              "rationale": "The candidate response states this atomic fact accurately; its question-level cited locators point into the frozen snapshot and are semantically consistent with the preregistered oracle locators."
            }
          },
          "expected": "Version 0.1.1.0",
          "index": 3
        },
        {
          "arms": {
            "baseline": {
              "citedLocators": [
                "Configuration.xml:34-56",
                "Configuration.xml:269-276"
              ],
              "correct": true,
              "rationale": "The baseline response states this atomic fact accurately; its question-level cited locators point into the frozen snapshot and are semantically consistent with the preregistered oracle locators."
            },
            "candidate": {
              "citedLocators": [
                "Configuration.xml:34-56",
                "Configuration.xml:269-276"
              ],
              "correct": true,
              "rationale": "The candidate response states this atomic fact accurately; its question-level cited locators point into the frozen snapshot and are semantically consistent with the preregistered oracle locators."
            }
          },
          "expected": "ScriptVariant Russian",
          "index": 4
        },
        {
          "arms": {
            "baseline": {
              "citedLocators": [
                "Configuration.xml:34-56",
                "Configuration.xml:269-276"
              ],
              "correct": true,
              "rationale": "The baseline response states this atomic fact accurately; its question-level cited locators point into the frozen snapshot and are semantically consistent with the preregistered oracle locators."
            },
            "candidate": {
              "citedLocators": [
                "Configuration.xml:34-56",
                "Configuration.xml:269-276"
              ],
              "correct": true,
              "rationale": "The candidate response states this atomic fact accurately; its question-level cited locators point into the frozen snapshot and are semantically consistent with the preregistered oracle locators."
            }
          },
          "expected": "DefaultRunMode ManagedApplication",
          "index": 5
        },
        {
          "arms": {
            "baseline": {
              "citedLocators": [
                "Configuration.xml:34-56",
                "Configuration.xml:269-276"
              ],
              "correct": true,
              "rationale": "The baseline response states this atomic fact accurately; its question-level cited locators point into the frozen snapshot and are semantically consistent with the preregistered oracle locators."
            },
            "candidate": {
              "citedLocators": [
                "Configuration.xml:34-56",
                "Configuration.xml:269-276"
              ],
              "correct": true,
              "rationale": "The candidate response states this atomic fact accurately; its question-level cited locators point into the frozen snapshot and are semantically consistent with the preregistered oracle locators."
            }
          },
          "expected": "ConfigurationExtensionCompatibilityMode Version8_5_1",
          "index": 6
        }
      ],
      "questionId": "Q1"
    },
    {
      "items": [
        {
          "arms": {
            "baseline": {
              "citedLocators": [
                "HTTPServices/API/Ext/Module.bsl:1-7",
                "Configuration.xml:765-828",
                "Configuration.xml:869-923",
                "Configuration.xml:544-677",
                "Configuration.xml:924-1026",
                "CommonModules/API/Ext/Module.bsl:1-1",
                "Configuration.xml:819-923"
              ],
              "correct": true,
              "rationale": "The baseline response states this atomic fact accurately; its question-level cited locators point into the frozen snapshot and are semantically consistent with the preregistered oracle locators."
            },
            "candidate": {
              "citedLocators": [
                "Documents/Трудозатраты/Ext/ObjectModule.bsl:1-5",
                "HTTPServices/API/Ext/Module.bsl:262-281",
                "Documents/Трудозатраты/Ext/ObjectModule.bsl:130-191",
                "Catalogs/Мессенджеры/Ext/ManagerModule.bsl:42-58",
                "CommonModules/РегламентныеЗаданияСервер/Ext/Module.bsl:706-713",
                "Configuration.xml:544-677",
                "Configuration.xml:765-828",
                "Configuration.xml:924-1026"
              ],
              "correct": true,
              "rationale": "The candidate response states this atomic fact accurately; its question-level cited locators point into the frozen snapshot and are semantically consistent with the preregistered oracle locators."
            }
          },
          "expected": "Corporate software-development/project-management system",
          "index": 1
        },
        {
          "arms": {
            "baseline": {
              "citedLocators": [
                "HTTPServices/API/Ext/Module.bsl:1-7",
                "Configuration.xml:765-828",
                "Configuration.xml:869-923",
                "Configuration.xml:544-677",
                "Configuration.xml:924-1026",
                "CommonModules/API/Ext/Module.bsl:1-1",
                "Configuration.xml:819-923"
              ],
              "correct": true,
              "rationale": "The baseline response states this atomic fact accurately; its question-level cited locators point into the frozen snapshot and are semantically consistent with the preregistered oracle locators."
            },
            "candidate": {
              "citedLocators": [
                "Documents/Трудозатраты/Ext/ObjectModule.bsl:1-5",
                "HTTPServices/API/Ext/Module.bsl:262-281",
                "Documents/Трудозатраты/Ext/ObjectModule.bsl:130-191",
                "Catalogs/Мессенджеры/Ext/ManagerModule.bsl:42-58",
                "CommonModules/РегламентныеЗаданияСервер/Ext/Module.bsl:706-713",
                "Configuration.xml:544-677",
                "Configuration.xml:765-828",
                "Configuration.xml:924-1026"
              ],
              "correct": false,
              "rationale": "The response evidences request/task creation, elapsed-time posting, API, messenger and scheduled mechanisms, but does not state sprint support. Because the preregistered expected item is atomic and includes request, task, sprint, elapsed-time documents and API, the complete item is not stated."
            }
          },